,datetime,label,title,source,link,article,key_sentences,fb_positive,fb_neutral,fb_negative,sentiment
71,1/27/2025 11:50:12 AM,NVDA,"Analysts’ Top Technology Picks: ServiceNow (NOW), Nvidia (NVDA)",TipRanks,https://markets.businessinsider.com/news/stocks/analysts-top-technology-picks-servicenow-now-nvidia-nvda-1034272039,"['There’s a lot to be optimistic about in the Technology sector as 3 analysts just weighed in on ServiceNow (NOW – Research Report), Nvidia (NVDA – Research Report) and NEXTracker, Inc. Class A (NXT – Research Report) with bullish sentiments.', ""Invest with Confidence: Follow TipRanks' Top Wall Street Analysts to uncover their success rate and average return."", 'Join thousands of data-driven investors – Build your Smart Portfolio for personalized insights.', 'ServiceNow (NOW)\n\nIn a report released today, Tyler Radke from Citi maintained a Buy rating on ServiceNow, with a price target of $1432.00.', 'The company’s shares closed last Friday at $1124.98, close to its 52-week high of $1157.90.', 'According to TipRanks.com, Radke is a 4-star analyst with an average return of 8.7% and a 55.1% success rate.', 'Radke covers the Technology sector, focusing on stocks such as ServiceTitan, Inc. Class A, Zoom Video Communications, and Palantir Technologies.', 'The word on The Street in general, suggests a Strong Buy analyst consensus rating for ServiceNow with a $1190.40 average price target, a 4.3% upside from current levels.', 'In a report issued on January 16, Cantor Fitzgerald also initiated coverage with a Buy rating on the stock with a $1332.00 price target.', 'See Insiders’ Hot Stocks on TipRanks >>\n\nNvidia (NVDA)\n\nCiti analyst Atif Malik maintained a Buy rating on Nvidia yesterday and set a price target of $175.00.', 'The company’s shares closed last Friday at $142.62, close to its 52-week high of $153.13.', 'According to TipRanks.com, Malik is a top 25 analyst with an average return of 34.2% and a 73.1% success rate.', 'Malik covers the Technology sector, focusing on stocks such as Skyworks Solutions, Applied Materials, and Juniper Networks.', 'The word on The Street in general, suggests a Strong Buy analyst consensus rating for Nvidia with a $177.56 average price target, a 19.7% upside from current levels.', 'In a report issued on January 13, Bank of America Securities also maintained a Buy rating on the stock.', 'NEXTracker, Inc. Class A (NXT)\n\nIn a report released today, Philip Shen from Roth MKM maintained a Buy rating on NEXTracker, Inc. Class A, with a price target of $55.00.', 'The company’s shares closed last Friday at $41.00.', 'According to TipRanks.com, Shen is a 4-star analyst with an average return of 5.3% and a 38.9% success rate.', 'Shen covers the Technology sector, focusing on stocks such as Sunnova Energy International, Shoals Technologies Group, and Array Technologies.', 'NEXTracker, Inc. Class A has an analyst consensus of Strong Buy, with a price target consensus of $51.67, implying a 24.3% upside from current levels.', 'In a report issued on January 16, Truist Financial also reiterated a Buy rating on the stock with a $54.00 price target.', 'Read More on NOW:']","There’s a lot to be optimistic about in the Technology sector as 3 analysts just weighed in on ServiceNow (NOW – Research Report), Nvidia (NVDA – Research Report) and NEXTracker, Inc. Class A (NXT – Research Report) with bullish sentiments. See Insiders’ Hot Stocks on TipRanks >>

Nvidia (NVDA)

Citi analyst Atif Malik maintained a Buy rating on Nvidia yesterday and set a price target of $175.00. The word on The Street in general, suggests a Strong Buy analyst consensus rating for Nvidia with a $177.56 average price target, a 19.7% upside from current levels.",0.9368342757225037,0.04452364891767502,0.01864202320575714,positive
72,1/27/2025 11:40:17 AM,NVDA,Wall Street Analysts Are Bullish on Top Technology Picks,TipRanks,https://markets.businessinsider.com/news/stocks/wall-street-analysts-are-bullish-on-top-technology-picks-1034271911,"['There’s a lot to be optimistic about in the Technology sector as 3 analysts just weighed in on Oracle (ORCL – Research Report), Nvidia (NVDA – Research Report) and International Business Machines (IBM – Research Report) with bullish sentiments.', ""Invest with Confidence: Follow TipRanks' Top Wall Street Analysts to uncover their success rate and average return."", 'Join thousands of data-driven investors – Build your Smart Portfolio for personalized insights.', 'Oracle (ORCL)\n\nJefferies analyst Brent Thill maintained a Buy rating on Oracle today and set a price target of $220.00.', 'The company’s shares closed last Friday at $183.60, close to its 52-week high of $198.31.', 'According to TipRanks.com, Thill is a 5-star analyst with an average return of 9.2% and a 61.2% success rate.', 'Thill covers the Technology sector, focusing on stocks such as Palantir Technologies, Procore Technologies, and Progress Software.', 'Oracle has an analyst consensus of Moderate Buy, with a price target consensus of $192.88, which is a 2.2% upside from current levels.', 'In a report issued on January 16, Cantor Fitzgerald also initiated coverage with a Buy rating on the stock with a $214.00 price target.', 'See today’s best-performing stocks on TipRanks >>\n\nNvidia (NVDA)\n\nCantor Fitzgerald analyst C J Muse maintained a Buy rating on Nvidia today and set a price target of $200.00.', 'The company’s shares closed last Friday at $142.62, close to its 52-week high of $153.13.', 'According to TipRanks.com, Muse is a 5-star analyst with an average return of 29.8% and a 65.9% success rate.', 'Muse covers the Technology sector, focusing on stocks such as Advanced Micro Devices, GlobalFoundries Inc, and NXP Semiconductors.', 'The word on The Street in general, suggests a Strong Buy analyst consensus rating for Nvidia with a $177.56 average price target, a 19.7% upside from current levels.', 'In a report issued on January 13, Bank of America Securities also maintained a Buy rating on the stock.', 'International Business Machines (IBM)\n\nIn a report released yesterday, Matthew Swanson from RBC Capital maintained a Buy rating on International Business Machines, with a price target of $250.00.', 'The company’s shares closed last Friday at $224.80.', 'According to TipRanks.com, Swanson is a 3-star analyst with an average return of 3.4% and a 48.6% success rate.', 'Swanson covers the Technology sector, focusing on stocks such as Zeta Global Holdings Corp, DoubleVerify Holdings, and Trade Desk.', 'International Business Machines has an analyst consensus of Moderate Buy, with a price target consensus of $230.70, a 2.4% upside from current levels.', 'In a report issued on January 24, Evercore ISI also maintained a Buy rating on the stock with a $240.00 price target.', 'Read More on ORCL:']","There’s a lot to be optimistic about in the Technology sector as 3 analysts just weighed in on Oracle (ORCL – Research Report), Nvidia (NVDA – Research Report) and International Business Machines (IBM – Research Report) with bullish sentiments. See today’s best-performing stocks on TipRanks >>

Nvidia (NVDA)

Cantor Fitzgerald analyst C J Muse maintained a Buy rating on Nvidia today and set a price target of $200.00. The word on The Street in general, suggests a Strong Buy analyst consensus rating for Nvidia with a $177.56 average price target, a 19.7% upside from current levels.",0.9427927732467651,0.03819027170538902,0.01901700533926487,positive
73,1/27/2025 11:36:12 AM,NVDA,B. Riley remains bullish on nuclear energy amid Nvidia concerns,TipRanks,https://markets.businessinsider.com/news/stocks/b-riley-remains-bullish-on-nuclear-energy-amid-nvidia-concerns-1034271917,"['B. Riley analyst Yuan Zhi reiterates a Buy rating on Mirion (MIR) amid concerns regarding DeepSeek.', 'Over the weekend, reported said China’s DeepSeek costs 97% less but outperforms OpenAI, the analyst tells investors in a research note.', 'The firm says the investment community suddenly questioned whether we have an oversupply of Nvidia (NVDA) chips.', 'With improved efficiency and more computing power available, U.S.-made artificial intelligence could improve current AI to another level, contends B. Riley.', 'It views lower cost and higher function as an important inflection point for broader AI adoption.', 'The training cost of DeepSeek might be lower, but DeepSeek will not stop at a V3 or R1 version, just like U.S.-made ChatGPT and LLaMa will continue to evolve, the firm adds.', 'Riley remains bullish on nuclear energy development, which it expects to ultimately benefit service and product providers, such as Mirion.', ""Invest with Confidence: Follow TipRanks' Top Wall Street Analysts to uncover their success rate and average return."", 'Join thousands of data-driven investors – Build your Smart Portfolio for personalized insights.']","The firm says the investment community suddenly questioned whether we have an oversupply of Nvidia (NVDA) chips. With improved efficiency and more computing power available, U.S.-made artificial intelligence could improve current AI to another level, contends B. Riley.",0.9210256934165955,0.06653013825416565,0.012444179505109787,positive
74,1/27/2025 11:36:04 AM,NVDA,"DeepSeek V3 ‘bullish’ for Nvidia, would buy on weakness, says Cantor Fitzgerald",TipRanks,https://markets.businessinsider.com/news/stocks/deepseek-v3-bullish-for-nvidia-would-buy-on-weakness-says-cantor-fitzgerald-1034271918,"['DeepSeek’s V3 large language model is “actually very bullish” for Nvidia (NVDA) and compute, despite “great angst” around the impact for compute demand and fears of peak spending on GPUs, Cantor Fitzgerald tells investors.', 'The firm says DeepSeek’s advances mean artificial general intelligence is closer, and that work will continue on pre-training, post-training, and time-based inference/reasoning, and future investments in large-scale clusters will only accelerate, all of which is bullish for AI.', 'The firm would buy shares of Nvidia on any potential weakness.', 'Cantor has an Overweight rating and $200 price target on the shares.', ""Invest with Confidence: Follow TipRanks' Top Wall Street Analysts to uncover their success rate and average return."", 'Join thousands of data-driven investors – Build your Smart Portfolio for personalized insights.']","DeepSeek’s V3 large language model is “actually very bullish” for Nvidia (NVDA) and compute, despite “great angst” around the impact for compute demand and fears of peak spending on GPUs, Cantor Fitzgerald tells investors. The firm says DeepSeek’s advances mean artificial general intelligence is closer, and that work will continue on pre-training, post-training, and time-based inference/reasoning, and future investments in large-scale clusters will only accelerate, all of which is bullish for AI. The firm would buy shares of Nvidia on any potential weakness.",0.9023684859275818,0.0809045359492302,0.016726894304156303,positive
75,1/27/2025 11:00:58 AM,NVDA,"DeepSeek buzz sending shockwaves through tech stocks, Bloomberg reports",TipRanks,https://markets.businessinsider.com/news/stocks/deepseek-buzz-sending-shockwaves-through-tech-stocks-bloomberg-reports-1034271746,"['Chinese artificial intelligence startup DeepSeek sent shockwaves through global technology stocks on Monday, sparking concerns about America’s technological edge, Bloomberg’s Abhishek Vishnoi, Winnie Hsu, and Jan-Patrick Barnert report.Over the weekend, excitement surged around DeepSeek’s newest AI model, which is being praised for being cost-effective and capable of running on less-advanced chips.', 'This development has raised questions about the high valuations of companies like Nvidia (NVDA), which has driven the global AI stock boom due to its chips being deemed critical to the industry.', 'China’s DeepSeek is a large-language open source model that claims to rival offerings from OpenAI’s ChatGPT and Meta Platforms (META), while using a much smaller budgets.', 'Other publicly traded companies in the space include Advanced Micro Devices (AMD), Intel (INTC), Qualcomm (QCOM), Marvel (MRVL), Texas Instruments (TXN), Micron (MU), Microchip (MCHP), and TSMC (TSM), and ASML (ASML).', ""Invest with Confidence: Follow TipRanks' Top Wall Street Analysts to uncover their success rate and average return."", 'Join thousands of data-driven investors – Build your Smart Portfolio for personalized insights.']","Chinese artificial intelligence startup DeepSeek sent shockwaves through global technology stocks on Monday, sparking concerns about America’s technological edge, Bloomberg’s Abhishek Vishnoi, Winnie Hsu, and Jan-Patrick Barnert report.Over the weekend, excitement surged around DeepSeek’s newest AI model, which is being praised for being cost-effective and capable of running on less-advanced chips. This development has raised questions about the high valuations of companies like Nvidia (NVDA), which has driven the global AI stock boom due to its chips being deemed critical to the industry. Other publicly traded companies in the space include Advanced Micro Devices (AMD), Intel (INTC), Qualcomm (QCOM), Marvel (MRVL), Texas Instruments (TXN), Micron (MU), Microchip (MCHP), and TSMC (TSM), and ASML (ASML).",0.491166889667511,0.430192232131958,0.07864081114530563,positive
76,1/27/2025 10:30:10 AM,NVDA,Nvidia sinks 11% as OpenAI rival DeepSeek goes live,TipRanks,https://markets.businessinsider.com/news/stocks/nvidia-sinks-11-as-openai-rival-deepseek-goes-live-1034271601,"['Shares of Nvidia (NVDA) are moving lower after DeepSeek-R1 went now live.', 'China’s DeepSeek is a large-language open source model that claims to rival offerings from OpenAI’s ChatGPT and Meta Platforms (META), while using a much smaller budgets.', 'DeepSeek’s release has raised concerns that technology companies could adopt more capital-efficient and cheaper approaches to artificial intelligence development.', 'Nvidia shares are down 11%, or $15.66, to $126.96 in premarket trading.', ""Invest with Confidence: Follow TipRanks' Top Wall Street Analysts to uncover their success rate and average return."", 'Join thousands of data-driven investors – Build your Smart Portfolio for personalized insights.']","Shares of Nvidia (NVDA) are moving lower after DeepSeek-R1 went now live. DeepSeek’s release has raised concerns that technology companies could adopt more capital-efficient and cheaper approaches to artificial intelligence development. Nvidia shares are down 11%, or $15.66, to $126.96 in premarket trading.",0.006676751188933849,0.019456854090094566,0.9738664627075195,negative
77,1/26/2025 4:05:13 PM,NVDA,"NVDA, GOOGL, or META: Which “Strong Buy” Magnificent 7 Stock has the Highest Upside Potential?",TipRanks,https://markets.businessinsider.com/news/stocks/nvda-googl-or-meta-which-strong-buy-magnificent-7-stock-has-the-highest-upside-potential-1034269126,"['The Magnificent 7 stocks: Alphabet (GOOGL), Amazon (AMZN), Apple (AAPL), Meta Platforms (META), Microsoft (MSFT), Nvidia (NVDA), and Tesla (TSLA), are prominent tech companies that are known for their market dominance, innovation, and influence on the NASDAQ (NDAQ) and S&P 500 (SPX) indices.', 'In 2024, semiconductor giant Nvidia led the pack, with a 171% gain fueled by the AI wave.', 'Using TipRanks’ Stock Comparison Tool, we will compare three Magnificent 7 stocks with a Strong Buy consensus rating and “Perfect 10” smart score to pick the one with the highest upside potential, according to analysts.', ""Invest with Confidence: Follow TipRanks' Top Wall Street Analysts to uncover their success rate and average return."", 'Join thousands of data-driven investors – Build your Smart Portfolio for personalized insights.', 'Nvidia (NASDAQ:NVDA)\n\nNvidia stock has rallied over 132%, thanks to the robust demand for its advanced GPUs (graphics processing units) that are required to power AI models.', 'The impressive growth in the company’s revenue and earnings in recent quarters reflects the solid momentum that NVDA’s GPUs are witnessing due to the ongoing generative AI boom.', 'Given these AI tailwinds, Nvidia has surpassed iPhone maker Apple (AAPL) to become the world’s most valuable company with a market cap of $3.61 trillion.', 'Looking ahead, there are high expectations from the company’s Blackwell platform.', 'Moreover, the company is expected to benefit from the recently announced U.S. AI infrastructure project called Stargate.', 'Is NVDA a Good Stock to Buy?', 'Recently, Barclays analyst Thomas O’Malley highlighted the semiconductor stocks that he likes for 2025, including Nvidia.', 'The analyst stated that Nvidia remains the dominant player in AI compute.', 'He expects the company’s data center compute business to grow by nearly 60% year-over-year in 2025, driven by next-generation GPUs and advancements in networking architecture.', 'O’Malley expects the company’s Blackwell offering to generate around $15 billion in revenue in the first quarter, with the potential to more than double the number quarter-over-quarter.', 'Additionally, the analyst sees significant upside in the second half of 2025, supported by the robust momentum in the B200 cycle and the growth in the B300/Ultra offerings.', 'With 36 Buys and three Holds, Nvidia stock scores a Strong Buy consensus rating.', 'The average NVDA stock price target of $176.86 implies 24% upside potential.', 'See more NVDA analyst ratings\n\nAlphabet (NASDAQ:GOOGL)\n\nAlphabet shares have risen about 35% over the past year.', 'The company reported market-beating third-quarter results, with 35% year-over-year growth in its Cloud unit and continued strength in the Search and YouTube businesses.', 'Despite investors’ concerns about the impact of growing competition in Search and regulatory pressures, Alphabet is optimistic about maintaining its dominance through its AI offerings.', 'Alphabet is scheduled to announce its Q4 2024 results on February 4.', 'Analysts expect the company’s EPS (earnings per share) to rise more than 29% year-over-year to $2.12.', 'They forecast a 12% growth in Q4 revenue to $96.62 billion.', 'What Is the Target Price for GOOGL Stock?', 'Heading into Alphabet’s Q4 2024 results, Truist Securities analyst Youssef Squali reiterated a Buy rating on the stock with a price target of $225.', 'The analyst expects Q4 results to reflect persistent momentum in Search, YouTube, and Cloud, with AI continuing to be in focus.', 'Notably, Squali expects GOOGL’s Q4 2024 results to be almost in line with the Street’s estimates, with revenue up by low double-digits.', 'Moreover, the analyst expects an operating margin of more than 30%, as efforts to control operating expenses are expected to have more than offset higher capital expenditure.', 'Overall, Alphabet stock scores Wall Street’s Strong Buy consensus rating based on 24 Buys and eight Holds.', 'The average GOOGL stock price target of $217.93 indicates about 9% upside potential from current levels.', 'See more GOOGL analyst ratings\n\nMeta Platforms (NASDAQ:META)\n\nMeta Platforms stock has rallied 66% over the past year, thanks to the company’s streamlining efforts and rebound in ad spending.', 'However, regulatory pressures, significant losses in the Reality Labs unit (operating loss of over $58 billion since 2020), and massive investments in AI could limit the upside in the stock this year.', 'On Friday, Meta CEO Mark Zuckerberg said that the company plans to invest $60 billion to $65 billion this year in capex to build AI infrastructure.', 'Zuckerberg views 2025 as “a defining year for AI.” The company expects its massive AI investments to drive innovation and future growth.', 'Meanwhile, Meta Platforms is scheduled to announce its Q4 2024 on January 29.', 'Analysts expect the social media giant to report about a 27% year-over-year jump in Q4 EPS to $6.75.', 'Revenue is expected to rise 17% to $46.97 billion.', 'Is META Stock a Buy, Sell, or Hold?', 'In reaction to Zuckerberg’s announcement of the $60 billion to $65 billion in capex to support the company’s product roadmap, Citi analyst Ronald Josey reiterated a Buy rating on META stock with a price target of $75 and called it his Top Pick.', 'Josey added that while Meta’s 2025 capex range is modestly ahead of his $58.5 billion estimate, he expects these investments to drive continued engagement growth and monetization benefits as “newer product vectors emerge, like Search (with Meta AI), Agents (with AI Studio), and Enterprise (with Llama 4), among others.”\n\nOverall, Wall Street has a Strong Buy consensus rating on META stock based on 40 Buys, three Holds, and one Sell rating.', 'The average META stock price target of $692.23 implies about 7% upside potential.', 'See more META analyst ratings\n\nConclusion\n\nWhile analysts are highly bullish on the three Magnificent 7 stocks discussed here, they see higher upside potential in NVDA stock even after a stellar rally over the past year.', 'Nvidia continues to capture the solid demand for its advanced GPUs in the AI space and is well-positioned to maintain its dominance in the semiconductor market through continued innovation and strong execution.', 'Disclosure']","The Magnificent 7 stocks: Alphabet (GOOGL), Amazon (AMZN), Apple (AAPL), Meta Platforms (META), Microsoft (MSFT), Nvidia (NVDA), and Tesla (TSLA), are prominent tech companies that are known for their market dominance, innovation, and influence on the NASDAQ (NDAQ) and S&P 500 (SPX) indices. In 2024, semiconductor giant Nvidia led the pack, with a 171% gain fueled by the AI wave. Nvidia (NASDAQ:NVDA)

Nvidia stock has rallied over 132%, thanks to the robust demand for its advanced GPUs (graphics processing units) that are required to power AI models. The impressive growth in the company’s revenue and earnings in recent quarters reflects the solid momentum that NVDA’s GPUs are witnessing due to the ongoing generative AI boom. Given these AI tailwinds, Nvidia has surpassed iPhone maker Apple (AAPL) to become the world’s most valuable company with a market cap of $3.61 trillion. Recently, Barclays analyst Thomas O’Malley highlighted the semiconductor stocks that he likes for 2025, including Nvidia. The analyst stated that Nvidia remains the dominant player in AI compute. He expects the company’s data center compute business to grow by nearly 60% year-over-year in 2025, driven by next-generation GPUs and advancements in networking architecture. With 36 Buys and three Holds, Nvidia stock scores a Strong Buy consensus rating. Nvidia continues to capture the solid demand for its advanced GPUs in the AI space and is well-positioned to maintain its dominance in the semiconductor market through continued innovation and strong execution.",0.9430960416793823,0.04565871134400368,0.0112453056499362,positive
