,datetime,label,title,source,link,article,key_sentences,fb_positive,fb_neutral,fb_negative,sentiment
44,1/28/2025 7:12:02 PM,NVDA,It's not just Nvidia: These under-the-radar winners of the AI revolution have been hit by DeepSeek mania,Business Insider,https://markets.businessinsider.com/news/stocks/tech-stock-selloff-ai-stocks-energy-utilities-deepseek-nuclear-power-2025-1,"[""The unexpected power of the Chinese startup DeepSeek's R1 AI model threw markets into chaos."", ""The unexpected power of the Chinese startup DeepSeek's R1 AI model threw markets into chaos."", ""Andy Wong/AP\n\nThe unexpected power of the Chinese startup DeepSeek's R1 AI model threw markets into chaos."", ""Andy Wong/AP\n\nThe DeepSeek wipeout did more than topple mega-cap tech stocks during Monday's sell-off — many of the under-the-radar winners of the artificial intelligence boom in the past year also plunged."", 'Panic consumed US investors after the Chinese startup DeepSeek introduced an AI tool said to be cheaper and more powerful and trained on less advanced chip technology.', 'The chatbot challenged the idea that AI initiatives require massive investment and energy, casting doubt on a narrative that has helped drive stellar gains for US stocks in the past two years.', 'When the dust settled, Nvidia had lost $589 billion in market cap, and more than $1 trillion in value had been erased from markets.', 'But the damage spread beyond the most popular tech stocks.', 'Before investors started questioning the need for massive capital expenditures to fund AI, the hundreds of billions of dollars spent by US hyperscalers sparked an investing renaissance in a separate corner of the market.', 'When it became clear that the new technology would require vast energy resources and new infrastructure, stocks in those corners of the market rallied.', 'A construction boom in AI data centers pushed utilities to become the third-best-performing sector of the S&P 500 in the first half of 2024, even though the sector typically suffers when growth stocks soar.', ""But many energy, infrastructure, and real-estate stocks, which investors had hoped were less crowded bets than stalwarts like Nvidia, were caught in Monday's sell-off."", 'Shares of the Global X Data Center & Digital Infrastructure ETF tumbled by about 3% and were down by another 1% on Tuesday afternoon.', 'Shares of the fund, which is backed by investments in data centers and other hardware infrastructure, gained 16% in 2024.', ""Digital Realty Trust stock was down by about 13% since Friday's close."", ""It's the only data-center real-estate investment trust trading on the New York Stock Exchange."", ""Shares of Super Micro Computer, which counts Nvidia among its customers, slumped by more than 18% from Friday's closing price."", 'The stock soared by triple digits in 2024 on investor bullishness around its business of supplying cooling technology for power-hungry GPU racks.', 'The biggest losers away from tech were in nuclear energy.', 'Nuclear-power firms had positioned themselves as key sources of energy crucial to keeping the AI boom going and reducing the strain on other sources.', 'Investors had been betting on a nuclear renaissance in 2025, encouraged by tech giants like Microsoft signing deals to buy power generated by nuclear plants.', 'Some of the top nuclear stocks tanked.', 'NuScale Power and Vistra plunged by as much as 24% and 26%.', 'The shares had climbed by 493% and 262% in 2024.', 'The nuclear providers Talen Energy and Constellation Energy also slid, falling by 21% and 20%.', ""Quanta Services, a firm specializing in electric power infrastructure and renewable energy, tanked by nearly 19% since Friday's close.""]","Andy Wong/AP

The DeepSeek wipeout did more than topple mega-cap tech stocks during Monday's sell-off — many of the under-the-radar winners of the artificial intelligence boom in the past year also plunged. When the dust settled, Nvidia had lost $589 billion in market cap, and more than $1 trillion in value had been erased from markets. A construction boom in AI data centers pushed utilities to become the third-best-performing sector of the S&P 500 in the first half of 2024, even though the sector typically suffers when growth stocks soar. But many energy, infrastructure, and real-estate stocks, which investors had hoped were less crowded bets than stalwarts like Nvidia, were caught in Monday's sell-off. Shares of the Global X Data Center & Digital Infrastructure ETF tumbled by about 3% and were down by another 1% on Tuesday afternoon. Shares of the fund, which is backed by investments in data centers and other hardware infrastructure, gained 16% in 2024. Shares of Super Micro Computer, which counts Nvidia among its customers, slumped by more than 18% from Friday's closing price. The stock soared by triple digits in 2024 on investor bullishness around its business of supplying cooling technology for power-hungry GPU racks.",0.009536710567772388,0.017905835062265396,0.9725574851036072,negative
45,1/28/2025 2:55:30 PM,NVDA,Tigress upgrades Nvidia to Strong Buy on ‘major buying opportunity’,TipRanks,https://markets.businessinsider.com/news/stocks/tigress-upgrades-nvidia-to-strong-buy-on-major-buying-opportunity-1034278693,"['Tigress Financial analyst Ivan Feinseth upgraded Nvidia (NVDA) to Strong Buy from Buy with a price target of $220, up from $170.', 'The firm views yesterday’s selloff as a “major buying opportunity.” The shares sank to their lowest level since early October following yesterday’s news that Chinese startup DeepSeek announced its R1 artificial intelligence model with reasoning capabilities similar to OpenAI at a lower development and operating cost, the analyst tells investors in a research note.', 'Tigress believes the actual capabilities of DeepSeek’s R1 AI model are unknown, and says there are “tremendous concerns about security.” AI and the data centers they run on will be a multiyear ongoing investment in buildout and development, and Nvidia will be a key beneficiary as it continues to be the number one supplier of AI-driving graphics processing units, contends the firm.', ""Invest with Confidence: Follow TipRanks' Top Wall Street Analysts to uncover their success rate and average return."", 'Join thousands of data-driven investors – Build your Smart Portfolio for personalized insights.']","Tigress Financial analyst Ivan Feinseth upgraded Nvidia (NVDA) to Strong Buy from Buy with a price target of $220, up from $170. The firm views yesterday’s selloff as a “major buying opportunity.” The shares sank to their lowest level since early October following yesterday’s news that Chinese startup DeepSeek announced its R1 artificial intelligence model with reasoning capabilities similar to OpenAI at a lower development and operating cost, the analyst tells investors in a research note. Tigress believes the actual capabilities of DeepSeek’s R1 AI model are unknown, and says there are “tremendous concerns about security.” AI and the data centers they run on will be a multiyear ongoing investment in buildout and development, and Nvidia will be a key beneficiary as it continues to be the number one supplier of AI-driving graphics processing units, contends the firm.",0.1434878408908844,0.04795791208744049,0.8085542321205139,negative
46,1/28/2025 2:55:15 PM,NVDA,Nvidia: Strong Buy Rating Reaffirmed on AI Leadership and Financial Robustness,TipRanks,https://markets.businessinsider.com/news/stocks/nvidia-strong-buy-rating-reaffirmed-on-ai-leadership-and-financial-robustness-1034278695,"['In a report released today, Ivan Feinseth from Tigress Financial reiterated a Buy rating on Nvidia (NVDA – Research Report), with a price target of $220.00.', ""Invest with Confidence: Follow TipRanks' Top Wall Street Analysts to uncover their success rate and average return."", 'Join thousands of data-driven investors – Build your Smart Portfolio for personalized insights.', 'Ivan Feinseth has given his Buy rating due to a combination of factors that highlight Nvidia’s strong position in the AI sector.', 'Nvidia’s leadership in GPU development and innovation positions it as a key player in AI technology, which is a significant driver of its revenue and cash flow growth.', 'The company’s advanced technology and new product introductions are expected to sustain its business performance and keep it at the forefront of AI adoption.', 'Additionally, Nvidia’s robust financial health, characterized by a strong balance sheet and cash flow, allows it to fund growth initiatives and strategic acquisitions effectively.', 'This financial strength also supports shareholder value through dividends and share repurchases.', 'The ongoing investment in AI across various industries, including healthcare and life sciences, presents further growth opportunities, reinforcing the Buy rating as a response to these promising prospects.', 'In another report released today, DBS also maintained a Buy rating on the stock with a $175.00 price target.', 'Based on the recent corporate insider activity of 132 insiders, corporate insider sentiment is negative on the stock.', 'This means that over the past quarter there has been an increase of insiders selling their shares of NVDA in relation to earlier this year.', 'TipRanks tracks over 100,000 company insiders, identifying the select few who excel in timing their transactions.', 'By upgrading to TipRanks Premium, you will gain access to this exclusive data and discover crucial insights to guide your investment decisions.', 'Begin your TipRanks Premium journey today.', 'Nvidia (NVDA) Company Description:\n\nNVIDIA Corp. designs and manufactures computer graphics processors, chipsets, and related multimedia software.', 'The company operates through two segments:\n\n• Graphics segment: Includes GeForce GPUs (graphics processing units) for gaming and PCs, the GeForce NOW game streaming service and related infrastructure, and solutions for gaming platforms, Quadro GPUs for enterprise design, GRID software for cloud-based visual and virtual computing, as well as automotive platforms for infotainment systems.', '• Compute & Networking segment: Includes Data Center platforms and systems for artificial intelligence, high performance computing, and accelerated computing, Mellanox networking and interconnect solutions, DRIVE for autonomous vehicles and Jetson for robotics and other embedded platforms.', 'The company was founded by Jen-Hsun Huang, Chris A. Malachowsky, and Curtis R. Priem in January 1993 and is headquartered in Santa Clara, CA.']","In a report released today, Ivan Feinseth from Tigress Financial reiterated a Buy rating on Nvidia (NVDA – Research Report), with a price target of $220.00. Ivan Feinseth has given his Buy rating due to a combination of factors that highlight Nvidia’s strong position in the AI sector. Nvidia’s leadership in GPU development and innovation positions it as a key player in AI technology, which is a significant driver of its revenue and cash flow growth. Additionally, Nvidia’s robust financial health, characterized by a strong balance sheet and cash flow, allows it to fund growth initiatives and strategic acquisitions effectively. Nvidia (NVDA) Company Description:

NVIDIA Corp. designs and manufactures computer graphics processors, chipsets, and related multimedia software. The company operates through two segments:

• Graphics segment: Includes GeForce GPUs (graphics processing units) for gaming and PCs, the GeForce NOW game streaming service and related infrastructure, and solutions for gaming platforms, Quadro GPUs for enterprise design, GRID software for cloud-based visual and virtual computing, as well as automotive platforms for infotainment systems. • Compute & Networking segment: Includes Data Center platforms and systems for artificial intelligence, high performance computing, and accelerated computing, Mellanox networking and interconnect solutions, DRIVE for autonomous vehicles and Jetson for robotics and other embedded platforms.",0.2428804337978363,0.7481979727745056,0.008921615779399872,neutral
47,1/28/2025 2:51:15 PM,NVDA,Nvidia upgraded to Strong Buy from Buy at Tigress Financial,TipRanks,https://markets.businessinsider.com/news/stocks/nvidia-upgraded-to-strong-buy-from-buy-at-tigress-financial-1034278697,"[""Tigress Financial upgraded Nvidia (NVDA) to Strong Buy from Buy with a $220 price target\n\nInvest with Confidence: Follow TipRanks' Top Wall Street Analysts to uncover their success rate and average return."", 'Join thousands of data-driven investors – Build your Smart Portfolio for personalized insights.']","Tigress Financial upgraded Nvidia (NVDA) to Strong Buy from Buy with a $220 price target

Invest with Confidence: Follow TipRanks' Top Wall Street Analysts to uncover their success rate and average return.",0.8431928157806396,0.14912980794906616,0.007677408400923014,positive
48,1/28/2025 2:00:39 PM,NVDA,Notable open interest changes for January 28th,TipRanks,https://markets.businessinsider.com/news/stocks/notable-open-interest-changes-for-january-28th-1034278490,"['Monday’s total option volume of 62.9 million contracts resulted in net open interest growth of 8.38 million calls and 6.61 million puts.', 'NVIDIA (NVDA), Broadcom (AVGO), Taiwan Semi (TSM) and Advanced Micro Devices (AMD) saw the greatest growth.', 'Top five new positions opened include 82k NVIDIA (NVDA) 1/31 weekly 130 calls, 63k NVIDIA (NVDA) 1/31 weekly 114 puts, 61k NVIDIA (NVDA) 1/31 weekly 100 puts, 59k NVIDIA (NVDA) 1/31 weekly 135 calls and 52k NVIDIA (NVDA) 1/31 weekly 125 calls.', ""Invest with Confidence: Follow TipRanks' Top Wall Street Analysts to uncover their success rate and average return."", 'Join thousands of data-driven investors – Build your Smart Portfolio for personalized insights.']","NVIDIA (NVDA), Broadcom (AVGO), Taiwan Semi (TSM) and Advanced Micro Devices (AMD) saw the greatest growth. Top five new positions opened include 82k NVIDIA (NVDA) 1/31 weekly 130 calls, 63k NVIDIA (NVDA) 1/31 weekly 114 puts, 61k NVIDIA (NVDA) 1/31 weekly 100 puts, 59k NVIDIA (NVDA) 1/31 weekly 135 calls and 52k NVIDIA (NVDA) 1/31 weekly 125 calls.",0.2462822049856186,0.7301306128501892,0.023587262257933617,neutral
49,1/28/2025 1:17:36 PM,NVDA,D.A. Davidson Sticks to Its Hold Rating for Nvidia (NVDA),TipRanks,https://markets.businessinsider.com/news/stocks/d-a-davidson-sticks-to-its-hold-rating-for-nvidia-nvda-1034278199,"['In a report released today, Gil Luria from D.A.', 'Davidson maintained a Hold rating on Nvidia (NVDA – Research Report), with a price target of $135.00.', 'The company’s shares closed yesterday at $118.42.', ""Invest with Confidence: Follow TipRanks' Top Wall Street Analysts to uncover their success rate and average return."", 'Join thousands of data-driven investors – Build your Smart Portfolio for personalized insights.', 'Luria covers the Technology sector, focusing on stocks such as Nvidia, Microsoft, and Adobe.', 'According to TipRanks, Luria has an average return of 20.6% and a 65.22% success rate on recommended stocks.', 'In addition to D.A.', 'Davidson, Nvidia also received a Hold from Deutsche Bank ‘s Ross Seymore in a report issued on January 10.', 'However, today, Citi assigned a Buy rating to Nvidia (NASDAQ: NVDA).', 'Based on Nvidia’s latest earnings release for the quarter ending October 27, the company reported a quarterly revenue of $35.08 billion and a net profit of $19.31 billion.', 'In comparison, last year the company earned a revenue of $18.12 billion and had a net profit of $9.24 billion\n\nBased on the recent corporate insider activity of 132 insiders, corporate insider sentiment is negative on the stock.', 'This means that over the past quarter there has been an increase of insiders selling their shares of NVDA in relation to earlier this year.', 'Last month, Tench Coxe, a Director at NVDA sold 1,000,000.00 shares for a total of $131,260,155.83.', 'TipRanks tracks over 100,000 company insiders, identifying the select few who excel in timing their transactions.', 'By upgrading to TipRanks Premium, you will gain access to this exclusive data and discover crucial insights to guide your investment decisions.', 'Begin your TipRanks Premium journey today.', 'Nvidia (NVDA) Company Description:\n\nNVIDIA Corp. designs and manufactures computer graphics processors, chipsets, and related multimedia software.', 'The company operates through two segments:\n\n• Graphics segment: Includes GeForce GPUs (graphics processing units) for gaming and PCs, the GeForce NOW game streaming service and related infrastructure, and solutions for gaming platforms, Quadro GPUs for enterprise design, GRID software for cloud-based visual and virtual computing, as well as automotive platforms for infotainment systems.', '• Compute & Networking segment: Includes Data Center platforms and systems for artificial intelligence, high performance computing, and accelerated computing, Mellanox networking and interconnect solutions, DRIVE for autonomous vehicles and Jetson for robotics and other embedded platforms.', 'The company was founded by Jen-Hsun Huang, Chris A. Malachowsky, and Curtis R. Priem in January 1993 and is headquartered in Santa Clara, CA.']","Davidson maintained a Hold rating on Nvidia (NVDA – Research Report), with a price target of $135.00. Luria covers the Technology sector, focusing on stocks such as Nvidia, Microsoft, and Adobe. Davidson, Nvidia also received a Hold from Deutsche Bank ‘s Ross Seymore in a report issued on January 10. However, today, Citi assigned a Buy rating to Nvidia (NASDAQ: NVDA). Based on Nvidia’s latest earnings release for the quarter ending October 27, the company reported a quarterly revenue of $35.08 billion and a net profit of $19.31 billion. Nvidia (NVDA) Company Description:

NVIDIA Corp. designs and manufactures computer graphics processors, chipsets, and related multimedia software. The company operates through two segments:

• Graphics segment: Includes GeForce GPUs (graphics processing units) for gaming and PCs, the GeForce NOW game streaming service and related infrastructure, and solutions for gaming platforms, Quadro GPUs for enterprise design, GRID software for cloud-based visual and virtual computing, as well as automotive platforms for infotainment systems. • Compute & Networking segment: Includes Data Center platforms and systems for artificial intelligence, high performance computing, and accelerated computing, Mellanox networking and interconnect solutions, DRIVE for autonomous vehicles and Jetson for robotics and other embedded platforms.",0.04662223532795906,0.9367910623550415,0.016586728394031525,neutral
50,1/28/2025 1:01:21 PM,NVDA,Nvidia price target lowered to $152 from $166 at Morgan Stanley,TipRanks,https://markets.businessinsider.com/news/stocks/nvidia-price-target-lowered-to-152-from-166-at-morgan-stanley-1034278113,"['Morgan Stanley lowered the firm’s price target on Nvidia (NVDA) to $152 from $166 and keeps an Overweight rating on the shares.', 'The DeepSeek release highlights evolutionary innovations in AI, “some of which may be deflationary,” the analyst tells investors.', 'While the magnitude of the reaction to DeepSeek’s release was “surprising,” the stock market reaction is “probably more important than the cause” and could bring further export controls or reduce spending enthusiasm, adds the analyst, who is trimming price targets among semiconductor suppliers exposed to AI, but remains positive on the group.', ""Invest with Confidence: Follow TipRanks' Top Wall Street Analysts to uncover their success rate and average return."", 'Join thousands of data-driven investors – Build your Smart Portfolio for personalized insights.']",Morgan Stanley lowered the firm’s price target on Nvidia (NVDA) to $152 from $166 and keeps an Overweight rating on the shares.,0.05939885973930359,0.2121742218732834,0.7284269332885742,negative
51,1/28/2025 1:00:17 PM,NVDA,NVIDIA put buyer realizes 55% same-day gains,TipRanks,https://markets.businessinsider.com/news/stocks/nvidia-put-buyer-realizes-55-same-day-gains-1034278120,"['Notable profits for the buyer who lifted the $10.00 offer for 4,499 NVIDIA (NVDA) 2/28 weekly 128 puts yesterday at 09:36ET when underlying shares were trading at $126.34.', 'Shares closed at $118.42, and the puts at $15.46 for a mark-to-market profit of 55%, or $2455K, on the $4499K outlay.', ""Invest with Confidence: Follow TipRanks' Top Wall Street Analysts to uncover their success rate and average return."", 'Join thousands of data-driven investors – Build your Smart Portfolio for personalized insights.']","Notable profits for the buyer who lifted the $10.00 offer for 4,499 NVIDIA (NVDA) 2/28 weekly 128 puts yesterday at 09:36ET when underlying shares were trading at $126.34.",0.8983592391014099,0.08347659558057785,0.01816425286233425,positive
52,1/28/2025 12:31:02 PM,NVDA,"DeepSeek will create ‘faster unlock’ of chip demand, says JPMorgan",TipRanks,https://markets.businessinsider.com/news/stocks/deepseek-will-create-faster-unlock-of-chip-demand-says-jpmorgan-1034277898,"['JPMorgan analyst Harlan Sur believes the recent efficiency gains demonstrated by DeepSeek will serve to pull forward the adoption and scaling curve for inferencing and create a “faster unlock” of demand for higher performance artificial intelligence semiconductor solutions.', 'The firm says that following the launch of DeepSeek R1 last week, investors have expressed concerns regarding the intermediate and long-term implications for AI semiconductor spending given the company’s claims regarding its compute efficiency.', 'However, as cloud providers and hyperscalers continue to build larger training and inferencing cluster sizes, the trend will benefit custom application-specific integrated circuit suppliers like Broadcom (AVGO) and Marvell (MRVL), given their cost and power performance advantages, the analyst tells investors in a research note.', '“The bottom line is that innovation does not stop; it catalyzes new opportunities,” contends JPMorgan.', 'It reiterates Overweight ratings on Broadcom, Marvell, and Nvidia (NVDA).', ""Invest with Confidence: Follow TipRanks' Top Wall Street Analysts to uncover their success rate and average return."", 'Join thousands of data-driven investors – Build your Smart Portfolio for personalized insights.']","JPMorgan analyst Harlan Sur believes the recent efficiency gains demonstrated by DeepSeek will serve to pull forward the adoption and scaling curve for inferencing and create a “faster unlock” of demand for higher performance artificial intelligence semiconductor solutions. It reiterates Overweight ratings on Broadcom, Marvell, and Nvidia (NVDA).",0.8842159509658813,0.10387647897005081,0.01190762035548687,positive
53,1/28/2025 11:40:26 AM,NVDA,"Nvidia sees DeepSeek as newer opportunity catalyst, says Citi",TipRanks,https://markets.businessinsider.com/news/stocks/nvidia-sees-deepseek-as-newer-opportunity-catalyst-says-citi-1034277134,"['Citi analyst Atif Malik says that according to a statement given to Bloomberg, Nvidia (NVDA) views DeepSeek’s latest models as an “excellent AI advancement.” The company sees DeepSeek’s innovation as the catalyst of a newer opportunity around inference which Nvidia believes requires a large number of its graphics processing units and high-performance networking products, the analyst tells investors in a research note.', ""The firm keeps a Buy rating on Nvidia with a $175 price target\n\nInvest with Confidence: Follow TipRanks' Top Wall Street Analysts to uncover their success rate and average return."", 'Join thousands of data-driven investors – Build your Smart Portfolio for personalized insights.']","Citi analyst Atif Malik says that according to a statement given to Bloomberg, Nvidia (NVDA) views DeepSeek’s latest models as an “excellent AI advancement.” The company sees DeepSeek’s innovation as the catalyst of a newer opportunity around inference which Nvidia believes requires a large number of its graphics processing units and high-performance networking products, the analyst tells investors in a research note. The firm keeps a Buy rating on Nvidia with a $175 price target

Invest with Confidence: Follow TipRanks' Top Wall Street Analysts to uncover their success rate and average return.",0.670953631401062,0.3210504949092865,0.007995814085006714,positive
