,datetime,label,title,source,link,article,key_sentences,fb_positive,fb_neutral,fb_negative,sentiment
27,4/2/2025 1:55:01 PM,NVDA,New Tariffs Could Undermine U.S. AI Stargate Project,TipRanks,https://markets.businessinsider.com/news/stocks/new-tariffs-could-undermine-u-s-ai-stargate-project-1034543516,"['The U.S. wants to lead the world in AI.', 'That’s the aim behind Stargate, a bold $500 billion plan to build huge new AI data hubs nationwide.', 'But just as the project takes off, the new trading policies taking effect today, which is referred to as ‘Liberation Day,’ may hamper its progression and may cause unforeseen challenges.', ""Don't Miss Our End of Quarter Offers:\n\nDiscover the latest stocks recommended by top Wall Street analysts, all in one place with Analyst Top Stocks."", 'Make smarter investments with weekly expert stock picks from the Smart Investor Newsletter.', 'These new tariffs increase the cost of key parts used to build these hubs—steel, copper, chips, and more.', 'Some parts are difficult to obtain at home, so many firms buy them abroad.', 'Tariffs May End Up Doing the Opposite\n\nAnalysts estimate that building each site may cost 3% to 5% more.', 'That may not sound like much, but it adds up when a site costs $100 billion or more.', 'Firms like Amazon (AMZN), Microsoft (MSFT), and Alphabet (GOOGL) are key backers of Stargate.', 'They may now have to spend billions more to meet the plan’s goals.', 'There’s also the chip side.', 'Stargate needs many AI chips from firms like NVIDIA (NVDA), whose parts often come from Asia.', 'The tariffs may slow that flow or raise the price.', 'And if China returns with its own trade moves, the cost and risk will increase even more.', 'The U.S. says Stargate will help break our tech ties to China.', 'But these trade moves may end up doing the reverse.', 'They may push back the build and give rivals like China time to catch up in AI.', 'That’s the big fear.', 'It’s too soon to say how bad the hit will be.', 'Some firms may shift how they buy gear or get tax help.', 'But the risk is clear.', 'The U.S. may have shot itself in the foot by adding cost and delay to its own AI plan.', 'A plan this bold needs less red tape, not more.', 'In this comparison chart, we’ve gathered and compared all the companies associated with the Stargate project.', 'Disclaimer & DisclosureReport an Issue']","Stargate needs many AI chips from firms like NVIDIA (NVDA), whose parts often come from Asia.",0.1597529947757721,0.8303658366203308,0.009881237521767616,neutral
28,4/2/2025 1:54:57 PM,NVDA,Trump Tariffs Set to Drive Up Tech Industry Costs,TipRanks,https://markets.businessinsider.com/news/stocks/trump-tariffs-set-to-drive-up-tech-industry-costs-1034543517,"['‘Liberation Day’ is here, and we can safely assume that the big tech firms are on edge.', 'The hit will be broad, and the bill could be significant, from chips to phones.', ""Don't Miss Our End of Quarter Offers:\n\nDiscover the latest stocks recommended by top Wall Street analysts, all in one place with Analyst Top Stocks."", 'Make smarter investments with weekly expert stock picks from the Smart Investor Newsletter.', 'The tariffs, which kick off today, impose new fees on key parts and goods from China, Europe, Mexico, and more.', 'If it’s imported, odds are it just got taxed.', 'That means U.S. firms now face higher costs for chips, phones, screens, wires, and even raw materials like steel and copper.', 'Apple (AAPL) could see each iPhone’s cost increase.', 'Tesla (TSLA) may pay more for car parts.', 'NVIDIA (NVDA) could face chip delays or fees just as it tries to meet huge AI demand.', 'The Chinese Effect\n\nThere’s a risk from abroad, too.', 'China has said it will strike back, imposing new tariffs on U.S. tech and farm goods.', 'That puts more stress on firms like Apple and Tesla, which rely on China for sales and plants, and chip giants like NVIDIA and Intel (INTC), who sell AI gear into that market.', 'It is little wonder tech stocks took a dip as news of the tariffs broke.', 'NVDA and TSLA saw red on the screen.', 'It’s not just cost; the threat of a full-on trade fight spooks investors.', 'There’s also a long-term risk.', 'If U.S. firms can’t get cheap parts or lose key buyers abroad, they may slow growth plans.', 'That could hit the whole AI boom and even the broader cloud, EV, and chip markets.', 'Timing Is Everything\n\nThe timing couldn’t be more at odds, as this move comes just as the U.S. pushes to extend its lead in AI and tech.', 'Projects like Stargate (a huge AI data hub push) now face more cost, red tape, and risk.', 'It’s a tough time to raise prices on the tools of the future.', 'In the short run, firms may pass some costs on to users.', 'You could pay more for gear, apps, or cloud tools.', 'In the long run, the U.S. may have to weigh the cost of trade rules that hit the tech world just as it’s set to soar.', 'In this comparison chart, we’ve collected some of the notable tech companies that could be negatively affected by the newly implemented tariffs.', 'Disclaimer & DisclosureReport an Issue']","NVIDIA (NVDA) could face chip delays or fees just as it tries to meet huge AI demand. That puts more stress on firms like Apple and Tesla, which rely on China for sales and plants, and chip giants like NVIDIA and Intel (INTC), who sell AI gear into that market.",0.010767149738967419,0.03663582727313042,0.9525970816612244,negative
29,4/2/2025 1:03:40 PM,NVDA,Notable open interest changes for April 2nd,TipRanks,https://markets.businessinsider.com/news/stocks/notable-open-interest-changes-for-april-2nd-1034543322,"['Tuesday’s total option volume of 46.1 million contracts resulted in net open interest growth of 5.51 million calls and 5.02 million puts.', 'Tesla (TSLA), NVIDIA (NVDA), Palantir Technologies (PLTR) and American Airlines (AAL) saw the greatest growth.', 'Top five new positions opened include 160k Palantir Technologies (PLTR) 4/25 weekly 60 puts, 84k American Airlines (AAL) Dec-27 5 puts, 75k Tesla (TSLA) 4/2 weekly 165.02 puts, 50k NVIDIA (NVDA) 4/25 weekly 70.01 puts and 32k JD.com (JD) Jul-25 65 calls.', ""Don't Miss Our End of Quarter Offers:\n\nDiscover the latest stocks recommended by top Wall Street analysts, all in one place with Analyst Top Stocks."", 'Make smarter investments with weekly expert stock picks from the Smart Investor Newsletter.']","Tesla (TSLA), NVIDIA (NVDA), Palantir Technologies (PLTR) and American Airlines (AAL) saw the greatest growth. Top five new positions opened include 160k Palantir Technologies (PLTR) 4/25 weekly 60 puts, 84k American Airlines (AAL) Dec-27 5 puts, 75k Tesla (TSLA) 4/2 weekly 165.02 puts, 50k NVIDIA (NVDA) 4/25 weekly 70.01 puts and 32k JD.com (JD) Jul-25 65 calls.",0.3927839398384094,0.5842108130455017,0.023005206137895584,neutral
30,4/2/2025 12:35:08 PM,NVDA,Which U.S. Companies Stand to Lose the Most from Tariffs?,TipRanks,https://markets.businessinsider.com/news/stocks/which-u-s-companies-stand-to-lose-the-most-from-tariffs-1034543203,"['Liberation Day is here, and President Donald Trump will announce new tariffs at 4 p.m.', 'ET.', 'The stock market is filled with anxiety today as investors await the President’s tariffs.', 'It’s unknown what these tariffs will cover, but some insiders claim President Trump plans to reveal a blanket 20% tariff on imports later today.', ""Don't Miss Our End of Quarter Offers:\n\nDiscover the latest stocks recommended by top Wall Street analysts, all in one place with Analyst Top Stocks."", 'Make smarter investments with weekly expert stock picks from the Smart Investor Newsletter.', 'With those tariffs in mind, investors wonder what effect Trump’s announcement will have on U.S. companies operating in foreign countries.', 'Tariffs could affect companies’ revenue as consumer habits overseas change after they go into effect.', 'There’s also the risk of retaliatory tariffs harming these companies’ operations in other countries.', 'Let’s dive into the U.S. companies that stand to lose the most from President Trump’s trade war.', '1.', 'Netflix\n\nNetflix’s (NFLX) video streaming service is available all around the world, opening the company up to the effects of tariffs.', 'According to Main Street Data, 101 million of its paid subscribers come from Europe, the Middle East, and Africa.', 'Another 53.3 million paid subscribers are in Latin America, while 57.5 million are based in the Asia Pacific region.', '89.9 million of its paid members come from the U.S. and Canada.', '2.', 'Nvidia\n\nNvidia (NVDA) joins this list as its graphics processing units (GPUs) and artificial intelligence (AI) services are used worldwide.', 'Main Street Data reports that the majority of its customers are based in the U.S., representing 50.7% of its revenue in Q1 2025.', 'That means 49.3% of its revenue comes from foreign countries.', 'Nvidia also sources much of its semiconductor parts from overseas.', '3.', 'Tesla\n\nTesla (TSLA) is another U.S. company with a large portion of its business overseas as it seeks to expand its electric vehicle sales beyond the country’s borders.', 'Main Street Data notes that 47.2% of its revenue comes from the U.S., compared to 23.5% from China and 29.3% from other regions.', 'Tesla is one of the companies most likely to be affected by consumer sentiment as founder and CEO Elon Musk leads the Department of Government Efficiency (DOGE).', 'This has already led to several Tesla vehicles being vandalized in the U.S.\n\n4.', 'Amazon\n\nAmazon (AMZN) is the world’s largest e-commerce company, with an emphasis on “world’s.” It could be heavily affected by President Trump’s tariffs, as Main Street Data highlights international sales of $43.4 billion, which represented 27.3% of its Q4 2024 revenue.', 'The online retailer also gets plenty of the products sold on its website from overseas, potentially affecting prices and sales in the U.S., which was 72.8% of its revenue in Q4.', '5.', 'Apple\n\nApple (AAPL) is expected to see huge impacts from tariffs as it sources most of its iPhone components from Taiwan and China.', 'Main Street Data shows Apple’s revenue is globally distributed, with 42.4% from the U.S., 27.2% from Europe, 14.9% from Greater China, 8.28% from the rest of Asia, and 7.23% from Japan in Q4 2024.', 'Are These Stocks Still Worth Investing In?', 'Turning to Wall Street, Nvidia and Amazon have consensus Strong Buy ratings with upside potentials of 60.27% and 40.16%, respectively.', 'Netflix and Apple are Moderate Buys with possible upsides of 19.49% for NFLX and 11.96% for AAPL.', 'Tesla is the lone Hold rating and has a potential 17.34% upside.', 'These ratings and price targets could change as Trump’s trade war escalates with additional tariffs.', 'See more U.S. stock comparisons\n\nDisclaimer & DisclosureReport an Issue']","Nvidia

Nvidia (NVDA) joins this list as its graphics processing units (GPUs) and artificial intelligence (AI) services are used worldwide. Nvidia also sources much of its semiconductor parts from overseas. Turning to Wall Street, Nvidia and Amazon have consensus Strong Buy ratings with upside potentials of 60.27% and 40.16%, respectively.",0.8106245398521423,0.18141335248947144,0.007962076924741268,positive
31,4/2/2025 11:28:27 AM,NVDA,SMCI Stock Set to Transition from Micro to Mighty as Wall St. Analysts Eye 40% Upside,TipRanks,https://markets.businessinsider.com/news/stocks/smci-stock-set-to-transition-from-micro-to-mighty-as-wall-st-analysts-eye-40-upside-1034542943,"['Super Micro Computer (SMCI) might have the word “micro” in its name, but make no mistake—this Silicon Valley-based server and storage powerhouse has been delivering mighty growth over the past three years.', 'With the boom in AI training, cloud data centers, and enterprise IT, Super Micro has surged 829%, alongside some of the hottest trends in technology.', ""Don't Miss Our End of Quarter Offers:\n\nDiscover the latest stocks recommended by top Wall Street analysts, all in one place with Analyst Top Stocks."", 'Make smarter investments with weekly expert stock picks from the Smart Investor Newsletter.', 'While the company’s most explosive alpha years—2023 and 2024—are now behind us, I believe the runway is far from finished.', 'Based on projected earnings per share growth and only a slight expansion in the price-to-earnings ratio, I’m targeting a 40% return from the stock over the next twelve months.', 'Super Micro Is Not So Micro\n\nLet’s start with the obvious: Super Micro’s growth has been anything but modest.', 'The surge in artificial intelligence workloads and expansion in cloud infrastructure has created ideal conditions for the company to thrive.', 'Management has been bold, too.', 'They’ve described the AI revolution as “much more impactful than the Industrial Revolution,” and they’re positioning Super Micro accordingly.', 'If that thesis holds true—and I believe it does—then the company is in a superb position to capitalize over the coming years.', 'One specific area where Super Micro stands out is liquid-cooled server design.', 'According to the company’s CEO, roughly 30% of new data centers are expected to adopt direct liquid cooling over the next twelve months.', 'That’s significant—and Super Micro is already a frontrunner in this space.', 'According to Main Street Data, SMCI’s revenues have grown as segment proportions have remained broadly consistent.', 'Let’s talk numbers.', 'In FY2024, SMCI posted 110% year-over-year revenue growth.', 'GAAP net income also surged, climbing 80% from the previous year.', 'Looking further back, from FY2021 through FY2024, Super Micro pulled off a stunning 60% compound annual growth rate in revenue—while only growing its operating expenses by 25%.', 'The company is scaling with discipline and efficiency, an increasingly rare feat in today’s hyper-growth tech landscape.', 'We’re already well into FY2025, with Q3 results expected in May.', 'For the full year, management is guiding toward approximately $24 billion in revenue, representing about 60% year-over-year growth.', 'They’re also quite bullish about FY2026, setting expectations for $40 billion in annual revenue.', 'That forecast may be optimistic, but the broader growth trajectory is undeniably strong—and the valuation doesn’t seem overstretched given the potential upside ahead.', 'Super Micro’s Price Cooldown\n\nCurrently, Super Micro stock is trading at ~$35 per share after a sharp pullback, meaning it’s priced at less than its trailing twelve-month revenue—a clear signal of value.', 'But investor sentiment has understandably cooled.', 'The company dealt with accounting-related issues in past years, and for many market participants, those concerns still linger.', 'Even so, a moderation to 60% revenue growth—the midpoint of current guidance—would take FY2025 revenue to around $24 billion and would exceed expectations, likely leading to a stock re-rating.', 'Looking further ahead to FY2026, I estimate Super Micro will generate around $3.75 in normalized earnings per share.', 'Applying a modest 13.5x non-GAAP P/E ratio—roughly in line with where the stock trades today—gives us a 12-month price target of $50.', 'That’s a potential return of about 40%, making a compelling case to stay bullish on SMCI stock.', 'Another High-Conviction Bet on AI\n\nSome investors are cautious about the AI space, wary of a potential repeat of the dot-com bubble.', 'But I believe this comparison falls short.', 'Every time major partners like Intel (INTC), AMD (AMD), or Nvidia (NVDA) release new chips, Super Micro is often first to market with compatible servers.', 'That kind of agility and first-mover advantage matters—especially when capital expenditures in data centers could scale to over $1 trillion annually in the next five to ten years.', 'Further underscoring the bullish sentiment, Super Micro is one of several core players in this megatrend that I believe deserves a seat in any forward-looking tech portfolio.', 'Alongside Nvidia, AMD, and early-stage hyperscalers like Nebius (NBIS), Super Micro adds meaningful exposure to the infrastructure layer of AI computing.', 'Of course, weighing the active risks is crucial; however, while the company has resolved its previous SEC filing delays, history still casts a shadow.', 'The stock would almost certainly take a steep dive if another accounting issue arises.', 'In financial markets, once bitten, twice shy.', 'Is Super Micro Computer a Good Stock to Buy?', 'On Wall Street, SMCI stock has a consensus rating of Hold based on four Buy, four Hold, and two Sell ratings over the past three months.', 'SMCI’s average price target of $49 per share implies approximately 40% upside potential over the next twelve months.', 'The consensus upside projection is not a guarantee, of course, but it provides some external validation for the bullish thesis.', 'And while analyst sentiment isn’t uniformly glowing, the general tone is far more constructive than what you’d expect from a stock with historically murky accounts.', 'In Super Micro’s case, the fundamentals are robust—if you’re comfortable with the volatility and believe in management’s future integrity.', 'SMCI Stands Tall as a Risk-On Play for AI Optimists\n\nLet’s not kid ourselves—Super Micro is a risk-on trade—but a calculated one.', 'Even if hyper-growth days are behind us, SMCI continues posting above-average revenue figures while trading at a reasonable valuation.', 'With my estimated $3.75 in normalized EPS by FY2026 and forward earnings multiples under 13.5x, this looks like a sensible entry point for long-term investors who believe in AI infrastructure as a secular theme.', 'Disclosure\n\nDisclaimer & DisclosureReport an Issue']","With the boom in AI training, cloud data centers, and enterprise IT, Super Micro has surged 829%, alongside some of the hottest trends in technology. The surge in artificial intelligence workloads and expansion in cloud infrastructure has created ideal conditions for the company to thrive. According to the company’s CEO, roughly 30% of new data centers are expected to adopt direct liquid cooling over the next twelve months. Every time major partners like Intel (INTC), AMD (AMD), or Nvidia (NVDA) release new chips, Super Micro is often first to market with compatible servers. That kind of agility and first-mover advantage matters—especially when capital expenditures in data centers could scale to over $1 trillion annually in the next five to ten years. Alongside Nvidia, AMD, and early-stage hyperscalers like Nebius (NBIS), Super Micro adds meaningful exposure to the infrastructure layer of AI computing.",0.7202824950218201,0.26971468329429626,0.01000281237065792,positive
32,4/2/2025 10:36:31 AM,NVDA,Here’s How Trump’s “Liberation Day” Tariffs Could Impact Chip Giant Nvidia (NVDA),TipRanks,https://markets.businessinsider.com/news/stocks/here-s-how-trump-s-liberation-day-tariffs-could-impact-chip-giant-nvidia-nvda-1034542685,"['All eyes are on the tariff announcements that U.S. President Donald Trump is expected to make at 4 p.m. EST on April 2, a day which he refers to as “Liberation Day,” as he believes that these tariffs will free the country from dependence on foreign goods.', 'Here, we will look at how the potential tariffs on several countries could impact chip giant Nvidia (NVDA).', 'Notably, NVDA stock has declined 18% so far this year amid tariff threats, chip export restrictions, and concerns over increased competition in the AI chip market.', ""Don't Miss Our End of Quarter Offers:\n\nDiscover the latest stocks recommended by top Wall Street analysts, all in one place with Analyst Top Stocks."", 'Make smarter investments with weekly expert stock picks from the Smart Investor Newsletter.', 'According to White House spokesperson Karoline Leavitt, reciprocal tariffs on countries that impose duties on U.S. goods would be effective as soon as Trump announces them, while a 25% tariff on auto imports will be effective from April 3.', 'Trump intends to address trade balances via these tariffs and encourage domestic production.', 'What the “Liberation Day” Tariffs Could Mean for Nvidia Stock\n\nIn Fiscal 2025, Nvidia generated 53% of its revenue from sales outside the U.S.', 'Retaliatory tariffs and the escalation of trade wars could weigh on the company’s business.', 'The Trump administration recently added many Chinese companies to an export blacklist, citing national security concerns.', 'U.S. chip companies like Nvidia will be required to get government approval if they intend to sell chips to these Chinese companies.', 'Any further restrictions or tariffs announced by Trump on China on the “Liberation Day” could weigh on Nvidia’s revenue from this key market.', 'According to Main Street Data, China contributed $17.1 billion or 13% of Nvidia’s Fiscal 2025 revenue of $130.5 billion.', 'Meanwhile, in its Fiscal 2025 annual report, Nvidia mentioned that its supply chain is mainly concentrated in the Asia-Pacific region.', 'Notably, the company is dependent on foundries, such as Taiwan Semiconductor Manufacturing Company Limited (TSM), or TSMC, and Samsung Electronics Co. (SSNLF), for the production of its semiconductor wafers.', 'While TSMC announced a $100 billion investment in the U.S. to build three new fabs and two advanced packaging facilities, any decision by Trump to slap tariffs on Taiwan could adversely impact Nvidia’s supply chain.', 'According to TipRanks’ Risk Analysis Tool, Production Risks account for 17.4% of NVDA’s overall risks, higher than the sector average of 12.9%.', 'Aside from the potential disruption to Nvidia’s supply chain and a possible rise in costs, a trade war with Taiwan would also hit the maker of advanced GPUs (graphic processing units) on the revenue side, as it is the second-largest international market for the company and accounted for around 16% of the overall revenue in Fiscal 2025.', 'Meanwhile, Bank of America analyst Vivek Arya has cautioned that the uncertainty related to the U.S. export rules for AI chips, also called the AI Diffusion Rule, could cause persistent volatility in NVDA stock until the “Liberation Day,” when the market begins to price in the rule’s actual impact.', 'The AI Diffusion Rule, which aims to limit the export of powerful AI chips, is expected to take effect on May 15.', 'Is NVDA Stock a Buy, Sell, or Hold?', 'Despite the ongoing challenges, Wall Street is currently bullish on Nvidia stock based on the robust demand for its advanced GPUs to build AI models.', 'NVDA stock scores a Strong Buy consensus rating based on 39 Buys and three Holds.', 'The average NVDA stock price target of $176.54 implies 60.3% upside potential from current levels.', 'See more NVDA analyst ratings\n\nDisclaimer & DisclosureReport an Issue']","Here, we will look at how the potential tariffs on several countries could impact chip giant Nvidia (NVDA). What the “Liberation Day” Tariffs Could Mean for Nvidia Stock

In Fiscal 2025, Nvidia generated 53% of its revenue from sales outside the U.S. U.S. chip companies like Nvidia will be required to get government approval if they intend to sell chips to these Chinese companies. Any further restrictions or tariffs announced by Trump on China on the “Liberation Day” could weigh on Nvidia’s revenue from this key market. According to Main Street Data, China contributed $17.1 billion or 13% of Nvidia’s Fiscal 2025 revenue of $130.5 billion. Meanwhile, in its Fiscal 2025 annual report, Nvidia mentioned that its supply chain is mainly concentrated in the Asia-Pacific region. While TSMC announced a $100 billion investment in the U.S. to build three new fabs and two advanced packaging facilities, any decision by Trump to slap tariffs on Taiwan could adversely impact Nvidia’s supply chain. Aside from the potential disruption to Nvidia’s supply chain and a possible rise in costs, a trade war with Taiwan would also hit the maker of advanced GPUs (graphic processing units) on the revenue side, as it is the second-largest international market for the company and accounted for around 16% of the overall revenue in Fiscal 2025. Meanwhile, Bank of America analyst Vivek Arya has cautioned that the uncertainty related to the U.S. export rules for AI chips, also called the AI Diffusion Rule, could cause persistent volatility in NVDA stock until the “Liberation Day,” when the market begins to price in the rule’s actual impact. The AI Diffusion Rule, which aims to limit the export of powerful AI chips, is expected to take effect on May 15. Despite the ongoing challenges, Wall Street is currently bullish on Nvidia stock based on the robust demand for its advanced GPUs to build AI models.",0.041914574801921844,0.08366220444440842,0.8744232654571533,negative
