,datetime,label,title,source,link,article,key_sentences,fb_positive,fb_neutral,fb_negative,sentiment
0,4/3/2025 11:39:15 PM,NVDA,Market’s Tariff Tantrum Overshadows Positive Developments for IonQ (IONQ),TipRanks,https://markets.businessinsider.com/news/stocks/market-s-tariff-tantrum-overshadows-positive-developments-for-ionq-ionq-1034549107,"['Quantum computing company IonQ (IONQ) has been selected by the U.S. Defense Advanced Research Projects Agency (DARPA) to participate in the first stage of its Quantum Benchmarking Initiative.', 'Despite the positive news, the stock finished the day down -7.19% as it was caught up in the market’s decline following President Trump’s tariff announcement.', 'However, the company’s stock is still up over 7% on the week on strength of news earlier in the week that the company has partnered with Amazon Web Services (AMZN) to offer its IonQ Forte Enterprise quantum computer on Amazon Braket, aiming to make quantum computing more accessible and foster the development of commercial applications.', 'Additionally, IonQ has secured significant financial backing through its recent equity offering.', ""Don't Miss Our End of Quarter Offers:\n\nDiscover the latest stocks recommended by top Wall Street analysts, all in one place with Analyst Top Stocks."", 'Make smarter investments with weekly expert stock picks from the Smart Investor Newsletter.', 'Advancing Quantum Computing on Several Fronts\n\nIonQ is a leader in quantum computing.', 'The company has established key revenue-generating partnerships with entities such as SK Telecom (SKM), the U.S. Air Force Research Laboratory, General Dynamics (GD), and Nvidia (NVDA).', 'The company has also collaborated on medical device design with Ansys (ANSS), demonstrating the superiority of quantum computing over classical computing in simulating blood pump dynamics for designing medical devices.', 'The company has been selected to participate in the initial phase of DARPA’s Quantum Benchmarking Initiative, which aims to evaluate the practicality of industrial quantum computers within their expected timeline.', 'As part of this initiative, IonQ will assist in establishing benchmarks for the utility-scale performance of quantum computers by analyzing use cases that demand large-scale machines and simultaneously advancing its own quantum computing technologies.', 'IonQ has also announced the global availability of its Forte Enterprise quantum computer through Amazon Braket and IonQ Quantum Cloud.', 'This development enables customers worldwide to explore the potential of quantum computing for a range of applications.', 'Further, the company has successfully raised approximately $360 million through its “at-the-market” equity offering program by selling 16,038,460 shares of common stock.', 'This strategic move was made to meet the company’s anticipated capital needs.', 'The company’s President and CEO, Niccolo De Masi, expressed satisfaction with the capital raised, stating it supports IonQ’s ongoing leadership in the quantum computing and networking sectors.', 'Analyst Responding Positively\n\nAnalysts’ responses to recent news have been mostly positive.', 'David Williams from Benchmark Co. has reiterated a Buy rating for IonQ while maintaining a price target of $45 for the shares, citing strategic developments within the company, notably a significant transition in executive leadership that could introduce fresh strategies.', 'Additionally, IonQ’s acquisition of ID Quantique is a key move aimed at boosting its technological prowess and expanding its market presence.', 'The recent successful capital raising underscores strong investor trust and equips IonQ with the resources necessary to advance its initiatives in quantum computing.', 'Williams believes these factors combined indicate a promising trajectory for IonQ.', 'IonQ is rated a Moderate Buy overall, based on the recent recommendations of six analysts.', 'The average price target for IONQ stock is $41.60, which represents a potential upside of 78.92% from current levels.', 'See more IONQ analyst ratings.', 'Disclaimer & DisclosureReport an Issue']","The company has established key revenue-generating partnerships with entities such as SK Telecom (SKM), the U.S. Air Force Research Laboratory, General Dynamics (GD), and Nvidia (NVDA).",0.9183536767959595,0.07165489345788956,0.009991456754505634,positive
1,4/3/2025 6:04:36 PM,NVDA,How Nvidia Helped Nintendo Make the Switch 2,TipRanks,https://markets.businessinsider.com/news/stocks/how-nvidia-helped-nintendo-make-the-switch-2-1034548726,"['Nvidia (NVDA) may currently be known as a powerhouse in the artificial intelligence (AI) sector, but the company has always had close ties to the video game industry.', 'Its graphics processing units (GPUs) power video games on PC, and it has also worked alongside console manufacturers, such as Nintendo (NTDOY), to power their gaming devices.', 'However, Microsoft (MSFT) and Sony (SONY) have opted for components from NVDA’s rival, Advanced Micro Devices (AMD), for their gaming solutions.', ""Don't Miss Our End of Quarter Offers:\n\nDiscover the latest stocks recommended by top Wall Street analysts, all in one place with Analyst Top Stocks."", 'Make smarter investments with weekly expert stock picks from the Smart Investor Newsletter.', 'With Nvidia providing the hardware behind the Nintendo Switch, it only makes sense that the video game giant would reach out to the company when it started developing the Switch 2.', 'This resulted in the GPU maker providing Nintendo with new technology to make its next handheld/home console hybrid 10 times stronger than its predecessor.', 'Nintendo Switch 2 Specs\n\nNvidia provided Nintendo with a custom processor for the Switch 2.', 'This includes a GPU that has dedicated RT Cores and Tensor Cores.', 'These cores provide the Switch 2 with more power and the ability to render higher resolutions and more detailed graphics than previous Nintendo devices.', 'The RT Cores provide RTX lighting support, while the Tensor Cores support AI-powered Deep Learning Super Sampling (DLSS) for sharper visuals.', 'With these Nvidia components powering the Nintendo Switch 2, the device can handle 4K gaming while docked and 1080p at 120 frames per second (FPS) in handheld mode.', 'Also included in the console are HDR support, AI face tracking, and AI background.', 'Is NVDA Stock a Buy, Sell, or Hold?', 'Turning to Wall Street, the analysts’ consensus estimate for Nvidia is Strong Buy based on 39 Buy and three Hold ratings over the last three months.', 'With that comes an average price target of $71.46, representing a potential 71.46% upside.', 'See more NVDA stock analyst ratings\n\nDisclaimer & DisclosureReport an Issue']","Nvidia (NVDA) may currently be known as a powerhouse in the artificial intelligence (AI) sector, but the company has always had close ties to the video game industry. Its graphics processing units (GPUs) power video games on PC, and it has also worked alongside console manufacturers, such as Nintendo (NTDOY), to power their gaming devices. However, Microsoft (MSFT) and Sony (SONY) have opted for components from NVDA’s rival, Advanced Micro Devices (AMD), for their gaming solutions. With Nvidia providing the hardware behind the Nintendo Switch, it only makes sense that the video game giant would reach out to the company when it started developing the Switch 2. This resulted in the GPU maker providing Nintendo with new technology to make its next handheld/home console hybrid 10 times stronger than its predecessor. Nintendo Switch 2 Specs

Nvidia provided Nintendo with a custom processor for the Switch 2. This includes a GPU that has dedicated RT Cores and Tensor Cores. With these Nvidia components powering the Nintendo Switch 2, the device can handle 4K gaming while docked and 1080p at 120 frames per second (FPS) in handheld mode. Turning to Wall Street, the analysts’ consensus estimate for Nvidia is Strong Buy based on 39 Buy and three Hold ratings over the last three months.",0.6070635318756104,0.3835308253765106,0.00940561294555664,positive
2,4/3/2025 5:50:51 PM,NVDA,AI Daily: Google in talks to rent AI servers from CoreWeave,TipRanks,https://markets.businessinsider.com/news/stocks/ai-daily-google-in-talks-to-rent-ai-servers-from-coreweave-1034548728,"[""Catch up on the top artificial intelligence news and commentary by Wall Street analysts on publicly traded companies in the space with this daily recap compiled by The Fly:\n\nDon't Miss Our End of Quarter Offers:\n\nDiscover the latest stocks recommended by top Wall Street analysts, all in one place with Analyst Top Stocks."", 'Make smarter investments with weekly expert stock picks from the Smart Investor Newsletter.', 'AI SERVERS: Google (GOOGL) is in advanced talks to rent Nvidia (NVDA) Blackwell chips for running artificial intelligence from CoreWeave (CRWV), two people briefed about the matter told The Information‘s Aaron Holmes, Stephanie Palazzolo and Anissa Gardizy.', 'The deal talks show how major Nvidia customers like Google are struggling to get enough of its chips to meet rising demand and also shows “how CoreWeave’s special relationship with Nvidia and its ability to move quickly in setting up AI-focused data centers is attracting business from large cloud providers,” the report stated.', 'LOGIK.AI ACQUISITION: ServiceNow (NOW) announced it signed a definitive agreement to acquire Logik.ai.', 'The transaction is subject to customary regulatory approvals and closing conditions.', 'Logik.ai’s capabilities for sales and commerce will expand ServiceNow’s CRM footprint.', 'The acquisition will accelerate ServiceNow’s momentum in sales and order management, a process that governs the commercial lifecycle from opportunity management, quoting, and order placement, through fulfillment and delivery, to renewals and expansions.', '“ServiceNow is advancing our commitment to offer robust, deeply connected CRM tools.', 'The configure, price, quote space is evolving, and Logik.ai is leading the way to a simpler, AI-powered selling experience across channels.', 'By adding Logik.ai’s industry-leading sales and commerce solution to our CRM offering, ServiceNow will further enhance our capability to sell, fulfill, and service on a single platform.', 'It’s about delivering a fundamentally different vision and approach to traditional CRM and configure, price, quote offerings – one that addresses the real pain points in connecting end-to-end customer experiences,” said John Ball, EVP and GM of CRM & industry workflows at ServiceNow.', 'MOVING TO THE SIDELINES: HSBC downgraded Nvidia to Hold from Buy with a price target of $120, down from $175.', 'Nvidia’s share price is down 26% since its previous peak in January, notes the firm, which sees limited GPU pricing power going forward that caps earnings upside potential until opportunities evolve in robotics, autos and AI markets.', 'HSBC sees limited room for significant earnings upside surprise over the next one to two years and potential re-rating headwinds that it thinks are “yet to be fully factored in by the market.”\n\nSWITCH 2: Nvidia said in a blog post that the Nintendo Switch 2 (NTDOY), unveiled April 2, takes performance to the next level, powered by a custom Nvidia processor featuring an Nvidia GPU with dedicated RT Cores and Tensor Cores for stunning visuals and AI-driven enhancements.', 'With 1,000 engineer-years of effort across every element – from system and chip design to a custom GPU, APIs and world-class development tools – the Nintendo Switch 2 brings major upgrades, the company said.', 'The new console enables up to 4K gaming in TV mode and up to 120 FPS at 1080p in handheld mode.', 'Nintendo Switch 2 also supports HDR, and AI upscaling to sharpen visuals and smooth gameplay.', 'The new RT Cores bring real-time ray tracing, delivering lifelike lighting, reflections and shadows for more immersive worlds.', 'Tensor Cores power AI-driven features like Deep Learning Super Sampling, boosting resolution for sharper details without sacrificing image quality.', 'Tensor Cores also enable AI-powered face tracking and background removal in video chat use cases, enhancing social gaming and streaming.']","Catch up on the top artificial intelligence news and commentary by Wall Street analysts on publicly traded companies in the space with this daily recap compiled by The Fly:

Don't Miss Our End of Quarter Offers:

Discover the latest stocks recommended by top Wall Street analysts, all in one place with Analyst Top Stocks. AI SERVERS: Google (GOOGL) is in advanced talks to rent Nvidia (NVDA) Blackwell chips for running artificial intelligence from CoreWeave (CRWV), two people briefed about the matter told The Information‘s Aaron Holmes, Stephanie Palazzolo and Anissa Gardizy. The deal talks show how major Nvidia customers like Google are struggling to get enough of its chips to meet rising demand and also shows “how CoreWeave’s special relationship with Nvidia and its ability to move quickly in setting up AI-focused data centers is attracting business from large cloud providers,” the report stated. MOVING TO THE SIDELINES: HSBC downgraded Nvidia to Hold from Buy with a price target of $120, down from $175. Nvidia’s share price is down 26% since its previous peak in January, notes the firm, which sees limited GPU pricing power going forward that caps earnings upside potential until opportunities evolve in robotics, autos and AI markets. HSBC sees limited room for significant earnings upside surprise over the next one to two years and potential re-rating headwinds that it thinks are “yet to be fully factored in by the market.”

SWITCH 2: Nvidia said in a blog post that the Nintendo Switch 2 (NTDOY), unveiled April 2, takes performance to the next level, powered by a custom Nvidia processor featuring an Nvidia GPU with dedicated RT Cores and Tensor Cores for stunning visuals and AI-driven enhancements. With 1,000 engineer-years of effort across every element – from system and chip design to a custom GPU, APIs and world-class development tools – the Nintendo Switch 2 brings major upgrades, the company said. The new console enables up to 4K gaming in TV mode and up to 120 FPS at 1080p in handheld mode. Tensor Cores also enable AI-powered face tracking and background removal in video chat use cases, enhancing social gaming and streaming.",0.020677033811807632,0.03798438236117363,0.9413385987281799,negative
3,4/3/2025 4:35:48 PM,NVDA,Nvidia says Switch 2 powered by custom Nvidia processor with AI-powered DLSS,TipRanks,https://markets.businessinsider.com/news/stocks/nvidia-says-switch-2-powered-by-custom-nvidia-processor-with-ai-powered-dlss-1034548624,"['Nvidia (NVDA) said in a blog post that the Nintendo Switch 2 (NTDOY), unveiled April 2, takes performance to the next level, powered by a custom Nvidia processor featuring an Nvidia GPU with dedicated RT Cores and Tensor Cores for stunning visuals and AI-driven enhancements.', 'With 1,000 engineer-years of effort across every element – from system and chip design to a custom GPU, APIs and world-class development tools – the Nintendo Switch 2 brings major upgrades, the company said.', 'The new console enables up to 4K gaming in TV mode and up to 120 FPS at 1080p in handheld mode.', 'Nintendo Switch 2 also supports HDR, and AI upscaling to sharpen visuals and smooth gameplay.', 'The new RT Cores bring real-time ray tracing, delivering lifelike lighting, reflections and shadows for more immersive worlds.', 'Tensor Cores power AI-driven features like Deep Learning Super Sampling, boosting resolution for sharper details without sacrificing image quality.', 'Tensor Cores also enable AI-powered face tracking and background removal in video chat use cases, enhancing social gaming and streaming.', ""Don't Miss Our End of Quarter Offers:\n\nDiscover the latest stocks recommended by top Wall Street analysts, all in one place with Analyst Top Stocks."", 'Make smarter investments with weekly expert stock picks from the Smart Investor Newsletter.']","Nvidia (NVDA) said in a blog post that the Nintendo Switch 2 (NTDOY), unveiled April 2, takes performance to the next level, powered by a custom Nvidia processor featuring an Nvidia GPU with dedicated RT Cores and Tensor Cores for stunning visuals and AI-driven enhancements. With 1,000 engineer-years of effort across every element – from system and chip design to a custom GPU, APIs and world-class development tools – the Nintendo Switch 2 brings major upgrades, the company said. The new console enables up to 4K gaming in TV mode and up to 120 FPS at 1080p in handheld mode. Tensor Cores also enable AI-powered face tracking and background removal in video chat use cases, enhancing social gaming and streaming.",0.6413751840591431,0.3476913571357727,0.010933459736406803,positive
4,4/3/2025 4:10:41 PM,NVDA,"Stocks plummet after Trump tariffs, JPMorgan warns of recession: Morning Buzz",TipRanks,https://markets.businessinsider.com/news/stocks/stocks-plummet-after-trump-tariffs-jpmorgan-warns-of-recession-morning-buzz-1034548635,"['The major averages were plummeting near noon, with the Dow shedding nearly 1,400 points and the Nasdaq down about 900 points after President Donald Trump unveiled sweeping new tariffs that have thrown global financial markets into a state of significant volatility.', 'The U.S. has imposed a baseline 10% tariff on all imports, with higher rates targeting specific countries: an incremental 34% on Chinese goods, 20% on European Union products, and 25% on imports from Japan and South Korea.', ""\u200b\n\nDon't Miss Our End of Quarter Offers:\n\nDiscover the latest stocks recommended by top Wall Street analysts, all in one place with Analyst Top Stocks."", 'Make smarter investments with weekly expert stock picks from the Smart Investor Newsletter.', 'Looking to commodities, gold prices are 1% lower, putting a damper on the metal’s recent rally, while oil prices have dropped nearly 8% amid concerns about both tariffs and higher production from members of OPEC+.', 'Investors are increasingly concerned about the potential for a global recession and stagflation – a combination of stagnant economic growth and rising inflation – stemming from the escalating trade tensions.', 'The CBOE Volatility Index has reached a three-week high, indicating heightened investor anxiety.', 'Get caught up quickly on the top news and calls moving stocks with these five Top Five lists.', '1.', 'STOCK NEWS:\n\nPresident Trump signed an executive order imposing 25% tariffs on all foreign-made autos as well as “reciprocal” tariff rates on dozens of other countries\n\nFollowing the tariff announcement, JPMorgan global economist Nora Szentivanyi said the firm expects aAAPL) shares are dropping as multiple analysts highlighted the tech giant in the wake of new tariffs, with Citi estimating a 9% negative gross margin impact on the company and Wedbush seeing “major pressure” on the iPhone maker\n\nConagra Brands ( CAG) reported lower-than-expected Q3 results and reiterated its guidance for FY25\n\nCAG) reported lower-than-expected Q3 results and reiterated its guidance for FY25 Hershey ( HSY) announced a deal to buy the LesserEvil popcorn brand\n\n2.', 'WALL STREET CALLS:\n\nNvidia ( NVDA) downgraded at HSBC, here’s why\n\nNVDA) downgraded at HSBC, here’s why Block ( XYZ) upgraded to Overweight at Morgan Stanley\n\nXYZ) upgraded to Overweight at Morgan Stanley Lyft ( LYFT) double downgraded to Underperform at BofA on AV overhang\n\nLYFT) double downgraded to Underperform at BofA on AV overhang Best Buy ( BBY) and RH (RH) downgraded at Citi as Trump’s worse than expected reciprocal tariff announcement “significantly changes” the firm’s view of the broadlines and hardlines sector\n\nBBY) and (RH) downgraded at Citi as Trump’s worse than expected reciprocal tariff announcement “significantly changes” the firm’s view of the broadlines and hardlines sector TJX ( TJX) and Ross Stores ( ROST) upgraded to Buy at Citi as the firm views off-price as “defensively positioned” in the near-term and well positioned for continued growth in the long-term\n\n3.', 'AROUND THE WEB:\n\nQualcomm ( QCOM) is considering making an offer for Alphawave (AWEVF), a London-listed semiconductor company which has a $1.3B market cap, Bloomberg reports\n\nQCOM) is considering making an offer for Alphawave (AWEVF), a London-listed semiconductor company which has a $1.3B market cap, Bloomberg reports Italian car parts manufacturer CLN-Coils Lamiere Nastri SpA is in talks to sell assets to Stellantis ( STLA), its main customer, amid discussions with lenders to cut its debt, Bloomberg says\n\nSTLA), its main customer, amid discussions with lenders to cut its debt, Bloomberg says Novo Nordisk ( NVO) executive Camilla Sylvest is departing the drugmaker after 28 years, Bloomberg says\n\nNVO) executive Camilla Sylvest is departing the drugmaker after 28 years, Bloomberg says Premca Capital, an investment fund with a less than 1% stake in WeightWatchers ( WW), is launching a proxy fight, and is seeking board seats and hundreds of millions of dollars in cost cuts, WSJ reports\n\nWW), is launching a proxy fight, and is seeking board seats and hundreds of millions of dollars in cost cuts, WSJ reports Volkswagen ( VWAGY) intends to add import fees to the sticker prices of vehicles shipped to the U.S., Bloomberg says\n\n4.', 'MOVERS:\n\n5.', 'EARNINGS/GUIDANCE:\n\nINDEXES:\n\nNear midday, the Dow was down 3.16%, or 1,333.92, to 40,891.40, the Nasdaq was down 4.85%, or 853.92, to 16,747.12, and the S&P 500 was down 3.80%, or 215.63, to 5,455.34.']","WALL STREET CALLS:

Nvidia ( NVDA) downgraded at HSBC, here’s why

NVDA) downgraded at HSBC, here’s why Block ( XYZ) upgraded to Overweight at Morgan Stanley

XYZ) upgraded to Overweight at Morgan Stanley Lyft ( LYFT) double downgraded to Underperform at BofA on AV overhang

LYFT) double downgraded to Underperform at BofA on AV overhang Best Buy ( BBY) and RH (RH) downgraded at Citi as Trump’s worse than expected reciprocal tariff announcement “significantly changes” the firm’s view of the broadlines and hardlines sector

BBY) and (RH) downgraded at Citi as Trump’s worse than expected reciprocal tariff announcement “significantly changes” the firm’s view of the broadlines and hardlines sector TJX ( TJX) and Ross Stores ( ROST) upgraded to Buy at Citi as the firm views off-price as “defensively positioned” in the near-term and well positioned for continued growth in the long-term

3.",0.488362580537796,0.12965227663516998,0.38198521733283997,positive
